{
  "conversation_id": "conv_01_FREEZE_v10_FINAL",
  "persona": {
    "role": "Nhân viên vận hành kinh doanh tại Phú Thọ",
    "job_story": "Theo dõi Thanh Sơn thường xuyên; sau một giai đoạn drill-down và theo dõi song song, được chuyển trọng tâm chính sang Thượng Long."
  },
  "metadata": {
    "language": "vi",
    "design_goal": "Natural long-term KiRa usage; job narrative first, benchmark annotations second.",
    "source_basis": "Hai bộ testcase KiRa do người dùng cung cấp.",
    "business_responses": "blank_until_filled_from_original_kira",
    "sessions": 22,
    "turns": 174,
    "kira_fill_slots": 39,
    "session_turn_counts": [
      10,
      8,
      6,
      10,
      8,
      6,
      10,
      6,
      6,
      8,
      10,
      10,
      8,
      6,
      8,
      10,
      6,
      8,
      8,
      6,
      8,
      8
    ],
    "version": "v10_FINAL",
    "assistant_bridge_count": 48,
    "assistant_bridge_unique": 48,
    "review_status": "FROZEN",
    "fill_id_policy": {
      "stable_across_revisions": true,
      "note": "Legacy CONV01V2_FILL_### identifiers are intentionally retained so previously collected KiRa responses remain join-compatible."
    }
  },
  "conversation": {
    "session_1_date_time": "2026-09-10T08:35:00+07:00",
    "session_1_goal": "Rà báo cáo tháng 8 của Thanh Sơn",
    "session_1": [
      {
        "role": "user",
        "dia_id": "D1:1",
        "text": "Sáng nay mình rà lại báo cáo tháng 8 của Thanh Sơn trước nhé."
      },
      {
        "role": "assistant",
        "dia_id": "D1:2",
        "text": "Ừ, mình lấy phần này trước.",
        "source": "synthetic_bridge"
      },
      {
        "role": "user",
        "dia_id": "D1:3",
        "text": "Cho mình doanh thu tiêu dùng di động Thanh Sơn tháng 8.",
        "fill_id": "CONV01V2_FILL_001"
      },
      {
        "role": "assistant",
        "dia_id": "D1:4",
        "text": "Doanh thu tiêu dùng di động của **Cụm Thanh Sơn - Phú Thọ** lũy kế tháng 08/2026 là **6,58 tỷ đồng**.\n\nThông tin chi tiết:\n* **Tăng trưởng so với cùng kỳ tháng trước:** <span style='color:green'>1,85%</span> (<span style='color:green'>0,12 tỷ</span>)\n* **Tăng trưởng so với cùng kỳ năm trước:** <span style='color:green'>8,99%</span> (<span style='color:green'>0,53 tỷ</span>)\n* **Xếp hạng thực hiện:** 14/32 cụm",
        "fill_id": "CONV01V2_FILL_001",
        "needs_kira_fill": true
      },
      {
        "role": "user",
        "dia_id": "D1:5",
        "text": "Lấy luôn thuê bao 4G thực lũy kế của Thanh Sơn tháng 8 giúp mình.",
        "fill_id": "CONV01V2_FILL_002"
      },
      {
        "role": "assistant",
        "dia_id": "D1:6",
        "text": "Chỉ tiêu tra cứu được là **Thuê bao Di động 4G thực Lũy kế** — khớp đúng yêu cầu của Anh/chị.\n\nDưới đây là số liệu **Lũy kế tháng 08/2026**:\n\n| Địa bàn | Thuê bao Di động 4G thực Lũy kế | Tăng trưởng so với cùng kỳ tháng trước | Tăng trưởng so với cùng kỳ năm trước | Xếp hạng thực hiện |\n| :--- | :--- | :--- | :--- | :--- |\n| **Cụm Thanh Sơn** | **67.879 TB** | **<span style='color:green'>49,68%</span> (<span style='color:green'>22.529 TB</span>)** | **<span style='color:green'>18,09%</span> (<span style='color:green'>10.398 TB</span>)** | **12/32** |\n| Cụm Phú Thọ | 71.746 TB | <span style='color:green'>65,86%</span> (<span style='color:green'>28.488 TB</span>) | <span style='color:green'>20,4%</span> (<span style='color:green'>12.158 TB</span>) | 9/32 |\n\n**Tổng kết giai đoạn:**\n* **Cụm Thanh Sơn:** Đạt **67.879 thuê bao**, tăng trưởng mạnh so với cùng kỳ tháng trước (**+49,68%**) và cùng kỳ năm trước (**+18,09%**), xếp hạng thực hiện thứ **12/32** cụm.\n* **Cụm Phú Thọ:** Đạt **71.746 thuê bao**, tăng trưởng cao hơn so với cùng kỳ tháng trước (**+65,86%**) và cùng kỳ năm trước (**+20,4%**), xếp hạng thực hiện thứ **9/32** cụm.",
        "fill_id": "CONV01V2_FILL_002",
        "needs_kira_fill": true
      },
      {
        "role": "user",
        "dia_id": "D1:7",
        "text": "Từ giờ nếu mình nói ngắn “bên mình” thì cứ hiểu là Thanh Sơn, Phú Thọ nhé; khi nào đổi mình sẽ nói."
      },
      {
        "role": "assistant",
        "dia_id": "D1:8",
        "text": "Được, mình bám đúng phạm vi vừa nêu.",
        "source": "synthetic_bridge"
      },
      {
        "role": "user",
        "dia_id": "D1:9",
        "text": "Mình thường thích câu trả lời gọn; hôm nay lại cần gửi bản tóm tắt trước trưa nên càng ngắn càng tốt."
      },
      {
        "role": "assistant",
        "dia_id": "D1:10",
        "text": "OK, anh cứ hỏi tiếp.",
        "source": "synthetic_bridge"
      }
    ],
    "session_2_date_time": "2026-09-15T14:10:00+07:00",
    "session_2_goal": "Rà mobile cuối ngày",
    "session_2": [
      {
        "role": "user",
        "dia_id": "D2:1",
        "text": "Chiều nay mình chỉ rà phần mobile của Thanh Sơn để đối chiếu với file tuần trước."
      },
      {
        "role": "assistant",
        "dia_id": "D2:2",
        "text": "Rõ rồi, mình giữ câu trả lời ngắn.",
        "source": "synthetic_bridge"
      },
      {
        "role": "user",
        "dia_id": "D2:3",
        "text": "Xem doanh thu tiêu dùng di động trừ VAS hợp tác của Thanh Sơn lũy kế đến hôm trước.",
        "fill_id": "CONV01V2_FILL_003"
      },
      {
        "role": "assistant",
        "dia_id": "D2:4",
        "text": "Chỉ tiêu tra cứu được là **Doanh thu tiêu dùng di động trừ vas hợp tác** — khớp với yêu cầu của Anh/chị.\n\nDữ liệu cho **Cụm Thanh Sơn (Phú Thọ)** lũy kế đến ngày 07/09/2026 như sau:\n\n* **Lũy kế tháng 09/2026** (từ 01/09 đến 07/09/2026): **3,08 tỷ**\n * Tăng trưởng so với cùng kỳ tháng trước: **<span style='color:green'>3,25%</span> (<span style='color:green'>0,1 tỷ</span>)**\n  * Tăng trưởng so với cùng kỳ năm trước: **<span style='color:green'>6,5%</span> (<span style='color:green'>0,19 tỷ</span>)**\n * Xếp hạng thực hiện: **8/32**\n\n* **Lũy kế năm 2026** (từ 01/01 đến 07/09/2026): **54,86 tỷ**\n * Tăng trưởng so với cùng kỳ năm trước: **<span style='color:green'>8,74%</span> (<span style='color:green'>4,41 tỷ</span>)**\n  * Xếp hạng thực hiện: **11/32**\n\n*(Lưu ý: Dữ liệu trên là của Cụm Thanh Sơn thuộc Tỉnh Phú Thọ. Hệ thống cũng trả về dữ liệu của toàn Tỉnh Phú Thọ để tham chiếu: Lũy kế tháng 09/2026 là 2,68 tỷ và Lũy kế năm 2026 là 56,88 tỷ).*",
        "fill_id": "CONV01V2_FILL_003",
        "needs_kira_fill": true
      },
      {
        "role": "user",
        "dia_id": "D2:5",
        "text": "Còn 4G thực lũy kế của Thanh Sơn đến hôm trước thì sao?",
        "fill_id": "CONV01V2_FILL_004"
      },
      {
        "role": "assistant",
        "dia_id": "D2:6",
        "text": "Dữ liệu **Thuê bao Di động 4G thực Lũy kế** của **Cụm Thanh Sơn (Phú Thọ)** lũy kế đến ngày **07/09/2026** như sau:\n\n* **Lũy kế tháng 09/2026** (từ 01/09 đến 07/09/2026): **33.261 TB**\n * Tăng trưởng so với cùng kỳ tháng trước: **<span style='color:green'>4,87%</span> (<span style='color:green'>1.546 TB</span>)**\n  * Tăng trưởng so với cùng kỳ năm trước: **<span style='color:red'>-19,81%</span> (<span style='color:red'>-8.219 TB</span>)**\n * Xếp hạng thực hiện: **8/32**\n\n* **Lũy kế năm 2026** (từ 01/01 đến 07/09/2026): **33.261 TB**\n * Tăng trưởng so với cùng kỳ năm trước: **<span style='color:red'>-19,81%</span> (<span style='color:red'>-8.219 TB</span>)**\n  * Xếp hạng thực hiện: **8/32**\n\n*Lưu ý: Số liệu lũy kế tháng và lũy kế năm tại thời điểm này có giá trị trùng nhau do dữ liệu mới chỉ tích lũy từ đầu tháng 9/2026.*",
        "fill_id": "CONV01V2_FILL_004",
        "needs_kira_fill": true
      },
      {
        "role": "user",
        "dia_id": "D2:7",
        "text": "Doanh thu tiêu dùng di động với 4G là hai số mình mở khá thường xuyên khi rà báo cáo."
      },
      {
        "role": "assistant",
        "dia_id": "D2:8",
        "text": "Được, mình theo đúng mốc đó.",
        "source": "synthetic_bridge"
      }
    ],
    "session_3_date_time": "2026-09-21T10:20:00+07:00",
    "session_3_goal": "Bổ sung FTTH",
    "session_3": [
      {
        "role": "user",
        "dia_id": "D3:1",
        "text": "Hôm nay mình bổ sung phần cố định vào báo cáo."
      },
      {
        "role": "assistant",
        "dia_id": "D3:2",
        "text": "Ừ, mình hiểu cách anh đang rà số.",
        "source": "synthetic_bridge"
      },
      {
        "role": "user",
        "dia_id": "D3:3",
        "text": "Cho mình FTTH phát triển thực lũy kế của Thanh Sơn tháng 8.",
        "fill_id": "CONV01V2_FILL_005"
      },
      {
        "role": "assistant",
        "dia_id": "D3:4",
        "text": "**Thuê bao FTTH phát triển thực lũy kế** của **Cụm Thanh Sơn - Phú Thọ** tính đến **lũy kế tháng 08/2026** là:\n\n* **Giá trị thực hiện:** **15.385 TB**\n* **Tăng trưởng so với cùng kỳ tháng trước:** **<span style='color:green'>1,22%</span> (<span style='color:green'>185 TB</span>)**\n* **Tăng trưởng so với cùng kỳ năm trước:** **<span style='color:green'>5,36%</span> (<span style='color:green'>783 TB</span>)**\n* **Xếp hạng thực hiện:** **6/32** (trong các cụm của tỉnh Phú Thọ)\n* **Xếp hạng tăng trưởng cùng kỳ tháng:** **4/32**\n* **Xếp hạng tăng trưởng cùng kỳ năm:** **18/32**",
        "fill_id": "CONV01V2_FILL_005",
        "needs_kira_fill": true
      },
      {
        "role": "user",
        "dia_id": "D3:5",
        "text": "Phần này chỉ để bổ sung cạnh mobile thôi, mình chưa cần đi sâu."
      },
      {
        "role": "assistant",
        "dia_id": "D3:6",
        "text": "OK, phần này mình không mở rộng thêm.",
        "source": "synthetic_bridge"
      }
    ],
    "session_4_date_time": "2026-09-28T16:05:00+07:00",
    "session_4_goal": "SME, IOT và truyền hình",
    "session_4": [
      {
        "role": "user",
        "dia_id": "D4:1",
        "text": "Phòng kinh doanh hỏi thêm mấy chỉ tiêu phụ của Thanh Sơn, mình gom một lượt luôn."
      },
      {
        "role": "assistant",
        "dia_id": "D4:2",
        "text": "Được, mình đi lần lượt.",